{"$id":"verification-record.schema.json","$schema":"https://json-schema.org/draft/2020-12/schema","additionalProperties":false,"properties":{"authorizations":{"additionalProperties":false,"properties":{"artifact_root_reuse":{"const":false,"type":"boolean"},"efficacy_claim":{"const":false,"type":"boolean"},"fixture_derived_claims":{"const":false,"type":"boolean"},"hook_registration":{"const":false,"type":"boolean"},"installed_settings_mutation":{"const":false,"type":"boolean"},"multi_file_redirection":{"const":false,"type":"boolean"},"package_helper_entry":{"const":false,"type":"boolean"},"packaging":{"const":false,"type":"boolean"},"provider_call":{"const":false,"type":"boolean"},"r9_reinterpretation":{"const":false,"type":"boolean"},"runtime_implementation":{"const":false,"type":"boolean"},"settings_default_plugin_change":{"const":false,"type":"boolean"},"spend":{"const":false,"type":"boolean"},"updated_input_mutation":{"const":false,"type":"boolean"}},"required":["artifact_root_reuse","efficacy_claim","fixture_derived_claims","hook_registration","installed_settings_mutation","multi_file_redirection","package_helper_entry","packaging","provider_call","r9_reinterpretation","runtime_implementation","settings_default_plugin_change","spend","updated_input_mutation"],"type":"object"},"blockers":{"items":false,"maxItems":6,"minItems":6,"prefixItems":[{"const":"EXACT_FRAMING_UNPROVEN","type":"string"},{"const":"EXTERNAL_GATES_INCOMPLETE","type":"string"},{"const":"HOST_OBSERVER_CONTRACT_UNSUPPORTED","type":"string"},{"const":"INERT_RESPONSE_UNPROVEN","type":"string"},{"const":"PROVIDER_JOIN_MISSING","type":"string"},{"const":"REAL_HOST_PERMISSION_OUTCOME_UNPROVEN","type":"string"}],"type":"array","uniqueItems":true},"charter_identity":{"additionalProperties":false,"properties":{"charter_id":{"const":"S3D-ARF","type":"string"},"charter_sha256":{"const":"f4a40efd4b526c15a44de97a2619d39c1a2db748704806fe0e0f6e882ced5a43","type":"string"},"schema_version":{"const":"contextguard-stage2-s3d-arf-charter/v1","type":"string"},"status":{"const":"inactive_provider_free","type":"string"}},"required":["charter_id","charter_sha256","schema_version","status"],"type":"object"},"claim_allowed":{"const":false,"type":"boolean"},"external_gates":{"additionalProperties":false,"properties":{"production_activation":{"const":"incomplete","type":"string"},"provider_join":{"const":"incomplete","type":"string"},"real_host_validation":{"const":"incomplete","type":"string"},"spend_authorization":{"const":"incomplete","type":"string"}},"required":["production_activation","provider_join","real_host_validation","spend_authorization"],"type":"object"},"provider_join_status":{"const":"missing","type":"string"},"runtime_observer_present":{"const":false,"type":"boolean"},"schema_version":{"const":"contextguard-stage2-verification-record/v1","type":"string"},"selected_branch":{"const":"S2-UNSUPPORTED","type":"string"},"selected_transport":{"const":"NONE","type":"string"},"surface_changes":{"additionalProperties":false,"properties":{"hook_registrations":{"items":false,"maxItems":0,"type":"array","uniqueItems":true},"package_helper_entries":{"items":false,"maxItems":0,"type":"array","uniqueItems":true},"runtime_files":{"items":false,"maxItems":0,"type":"array","uniqueItems":true},"settings_default_plugin_changes":{"items":false,"maxItems":0,"type":"array","uniqueItems":true}},"required":["hook_registrations","package_helper_entries","runtime_files","settings_default_plugin_changes"],"type":"object"}},"required":["authorizations","blockers","charter_identity","claim_allowed","external_gates","provider_join_status","runtime_observer_present","schema_version","selected_branch","selected_transport","surface_changes"],"title":"ContextGuard Stage 2 unsupported verification record","type":"object"}
