{"authorizations":{"artifact_root_reuse":false,"efficacy_claim":false,"fixture_derived_claims":false,"hook_registration":false,"installed_settings_mutation":false,"multi_file_redirection":false,"package_helper_entry":false,"packaging":false,"provider_call":false,"r9_reinterpretation":false,"runtime_implementation":false,"settings_default_plugin_change":false,"spend":false,"updated_input_mutation":false},"blockers":["EXACT_FRAMING_UNPROVEN","EXTERNAL_GATES_INCOMPLETE","HOST_OBSERVER_CONTRACT_UNSUPPORTED","INERT_RESPONSE_UNPROVEN","PROVIDER_JOIN_MISSING","REAL_HOST_PERMISSION_OUTCOME_UNPROVEN"],"charter_identity":{"charter_id":"S3D-ARF","charter_sha256":"f4a40efd4b526c15a44de97a2619d39c1a2db748704806fe0e0f6e882ced5a43","schema_version":"contextguard-stage2-s3d-arf-charter/v1","status":"inactive_provider_free"},"claim_allowed":false,"external_gates":{"production_activation":"incomplete","provider_join":"incomplete","real_host_validation":"incomplete","spend_authorization":"incomplete"},"provider_join_status":"missing","runtime_observer_present":false,"schema_version":"contextguard-stage2-verification-record/v1","selected_branch":"S2-UNSUPPORTED","selected_transport":"NONE","surface_changes":{"hook_registrations":[],"package_helper_entries":[],"runtime_files":[],"settings_default_plugin_changes":[]}}
